{"contractVersion":"graph/v2","requestId":"graph-request-1","graphSessionId":"graph-session-1","bundleHash":"sha256:aaaaaaaaaaaaaaaaaaaaaaaaaaaaaaaaaaaaaaaaaaaaaaaaaaaaaaaaaaaaaaaa","nextCursor":{"sequence":4,"completedCommandIds":["cmd-1","cmd-2"],"pendingCommandId":"cmd-3"},"command":{"commandId":"cmd-3","kind":"REVIEW_REQUIRED","inputHash":"sha256:bbbbbbbbbbbbbbbbbbbbbbbbbbbbbbbbbbbbbbbbbbbbbbbbbbbbbbbbbbbbbbbb","payload":{"taskPlanId":"plan-1","planStepId":"step-1"}},"ephemeral":true}
